<?xml version="1.0" encoding="UTF-8"?>
<!DOCTYPE actions [
  <!ELEMENT actions (action)+>

  <!ELEMENT action (icon|patterns|name|command|description|directories|audio-files|image-files|other-files|text-files|video-files)*>

  <!ELEMENT icon (#PCDATA)>
  <!ELEMENT command (#PCDATA)>
  <!ELEMENT patterns (#PCDATA)>

  <!ELEMENT name (#PCDATA)>
  <!ATTLIST name xml:lang CDATA #IMPLIED>

  <!ELEMENT description (#PCDATA)>
  <!ATTLIST description xml:lang CDATA #IMPLIED>

  <!ELEMENT directories EMPTY>
  <!ELEMENT audio-files EMPTY>
  <!ELEMENT image-files EMPTY>
  <!ELEMENT other-files EMPTY>
  <!ELEMENT text-files EMPTY>
  <!ELEMENT video-files EMPTY>
]>
<actions>

  <action>
    <icon>Terminal</icon>
    <patterns>*</patterns>
    <name>Open Terminal Here</name>
    <name xml:lang="ar">إفتح الطرفية هنا</name>
    <name xml:lang="ast">Abrir terminal equí</name>
    <name xml:lang="be">Адкрыць тут тэрмінал</name>
    <name xml:lang="bn">এখানে টার্মিনাল খুলুন</name>
    <name xml:lang="ca">Obre aquí un Terminal</name>
    <name xml:lang="cs">Otevřít terminál zde</name>
    <name xml:lang="da">Åbn terminal her</name>
    <name xml:lang="de">Terminal hier öffnen</name>
    <name xml:lang="dz">ནཱ་ལུ་ཊལ་མི་ནལ་ཁ་ཕྱེ།</name>
    <name xml:lang="el">Άνοιγμα τερματικού εδώ</name>
    <name xml:lang="en_GB">Open Terminal Here</name>
    <name xml:lang="eo">Malfermu terminalon ĉi tie</name>
    <name xml:lang="es">Abrir terminal aquí</name>
    <name xml:lang="et">Avada terminal siin</name>
    <name xml:lang="eu">Ireki terminala hemen</name>
    <name xml:lang="fi">Avaa pääte tässä kansiossa</name>
    <name xml:lang="fr">Ouvrir un terminal ici</name>
    <name xml:lang="gl">Abrir aquí unha terminal</name>
    <name xml:lang="he">פתיחת מסוף מכאן</name>
    <name xml:lang="hr">Otvori Terminal Ovdje</name>
    <name xml:lang="hu">Terminál nyitása itt</name>
    <name xml:lang="id">Buka Terminal Di sini</name>
    <name xml:lang="it">Apri un terminale qui</name>
    <name xml:lang="ja">ここで Terminal を開く</name>
    <name xml:lang="kk">Терминалды осында ашу</name>
    <name xml:lang="ko">이 위치에서 터미널 열기</name>
    <name xml:lang="ku">Li vir Termînalê Veke</name>
    <name xml:lang="lt">Atidaryti terminalą čia</name>
    <name xml:lang="lv">Atvērt šeit termināli</name>
    <name xml:lang="mk">Отворете терминал тука</name>
    <name xml:lang="nb">Åpne terminalvindu her</name>
    <name xml:lang="nl">Open hier een terminal</name>
    <name xml:lang="nn">Opna terminalen her</name>
    <name xml:lang="pa">ਇੱਥੇ ਟਰਮੀਨਲ ਖੋਲ੍ਹੋ</name>
    <name xml:lang="pl">Otwórz w terminalu</name>
    <name xml:lang="pt">Abrir terminal aqui</name>
    <name xml:lang="pt_BR">Abrir terminal aqui</name>
    <name xml:lang="ro">Deschide aici un terminal</name>
    <name xml:lang="ru">Открыть терминал</name>
    <name xml:lang="sk">Otvoriť v termináli</name>
    <name xml:lang="sq">Hap Terminalin Këtu</name>
    <name xml:lang="sv">Öppna terminal här</name>
    <name xml:lang="te">టెర్మినల్‌ను ఇక్కడ తెరువు</name>
    <name xml:lang="tr">Uçbirimi Buraya Aç</name>
    <name xml:lang="ug">بۇ يەردە تېرمىنالنى ئاچ</name>
    <name xml:lang="uk">Відкрити термінал тут</name>
    <name xml:lang="ur">ٹرمنل یہیں کھولیں</name>
    <name xml:lang="ur_PK">ٹرمنل یہیں کھولیں</name>
    <name xml:lang="vi">Mở Terminal tại thư mục này</name>
    <name xml:lang="zh_CN">在此打开终端</name>
    <name xml:lang="zh_TW">在此開啟終端機</name>
    <command>exo-open --working-directory %f --launch TerminalEmulator</command>
    <description>Example for a custom action</description>
    <description xml:lang="ast">Exemplu d'una aición personalizada</description>
    <description xml:lang="be">Прыклад адмысловага дзеяньня</description>
    <description xml:lang="bn">পছন্দসই কাজের জন্য উদাহরণ</description>
    <description xml:lang="ca">Exemple d'acció personalitzada</description>
    <description xml:lang="cs">Příklad vlastní akce</description>
    <description xml:lang="da">Eksempel på en tilpasset handling</description>
    <description xml:lang="de">Beispiel für eine eigene Aktion</description>
    <description xml:lang="dz">སྲོལ་སྒྲིག་བྱ་བ་ཅིག་གི་དོན་ལུ་དཔེ།</description>
    <description xml:lang="el">Παράδειγμα προσαρμοσμένης ενέργειας</description>
    <description xml:lang="en_GB">Example for a custom action</description>
    <description xml:lang="eo">Ekzemplo de kutima ago</description>
    <description xml:lang="es">Ejemplo de una acción personalizada</description>
    <description xml:lang="et">Kohandatud tegevuse näidis</description>
    <description xml:lang="eu">Ekintza pertsonalizatu adibidea</description>
    <description xml:lang="fi">Esimerkki mukautetusta toiminnosta</description>
    <description xml:lang="fr">Exemple d'une action personnalisée</description>
    <description xml:lang="gl">Exemplo dunha acción personalizada</description>
    <description xml:lang="he">דוגמה של פעולה מותאמת אישית</description>
    <description xml:lang="hu">Példa egyéni műveletre</description>
    <description xml:lang="id">Contoh untuk aksi suai</description>
    <description xml:lang="it">Esempio di azione personalizzata</description>
    <description xml:lang="ja">カスタムアクションの例です。</description>
    <description xml:lang="kk">Пайдаланушы әрекетінің мысалы</description>
    <description xml:lang="ko">사용자 정의 동작 에제</description>
    <description xml:lang="lt">Pasirinktinio veiksmo pavyzdys</description>
    <description xml:lang="lv">Paraugs pielāgotai darbībai</description>
    <description xml:lang="mk">Пример од сопствена акција</description>
    <description xml:lang="nb">Eksempel på en egentilpasset aksjon</description>
    <description xml:lang="nl">Voorbeeld van een aangepaste actie</description>
    <description xml:lang="nn">Døme på sjølvvald handling</description>
    <description xml:lang="pa">ਇੱਕ ਕਸਟਮ ਐਕਸ਼ਨ ਲਈ ਉਦਾਹਰਨ</description>
    <description xml:lang="pl">Otwiera terminal w bieżącym położeniu</description>
    <description xml:lang="pt">Exemplo de uma acção personalizada</description>
    <description xml:lang="pt_BR">Exemplo de uma ação personalizada</description>
    <description xml:lang="ro">Exemplu de acțiune personalizată</description>
    <description xml:lang="ru">Пример особого действия</description>
    <description xml:lang="sk">Príklad vlastnej akcie</description>
    <description xml:lang="sq">Shembull për veprim vetjak</description>
    <description xml:lang="sv">Exempel på en anpassad åtgärd</description>
    <description xml:lang="te">ఒక అనురూపిత చర్యకు ఉదాహరణ</description>
    <description xml:lang="tr">Özel işlem için örnek</description>
    <description xml:lang="ug">custom action ھەققىدىكى مىسال</description>
    <description xml:lang="uk">Приклад особливої дії</description>
    <description xml:lang="ur">مخصوص حرکت کی مثال</description>
    <description xml:lang="ur_PK">مخصوص حرکت کی مثال</description>
    <description xml:lang="vi">Ví dụ cho một hành động tuỳ biến</description>
    <description xml:lang="zh_CN">自定义动作示例</description>
    <description xml:lang="zh_TW">自訂動作範例</description>
    <directories/>
  </action>

  <action>
    <icon>gcr-key</icon>
    <name>Open as Root</name>
	<name xml:lang="en_GB">Open as Root</name>
	<name xml:lang="es">Abrir como administrador</name>
    <command>gksudo xdg-open %f</command>
    <description>Open as Root</description>
	<description xml:lang="en_GB">Open as Root</description>
	<description xml:lang="es">Abrir como administrador</description>
    <patterns>*</patterns>
    <directories/>
    <text-files/>
  </action>

  <action>
    <icon>filefind</icon>
    <name>Searcher</name>
	<name xml:lang="en_GB">Searcher</name>
	<name xml:lang="es">Buscador</name>
    <command>catfish --path=%f</command>
    <description>File and folder searcher</description>
	<description xml:lang="en_GB">File and folder searcher</description>
	<description xml:lang="es">Buscador de ficheros y carpetas</description>
    <patterns>*</patterns>
    <directories/>
  </action>

  <action>
    <icon>nm-device-wired-secure</icon>
    <name>Share / Unshare</name>
	<name xml:lang="en_GB">Share / Unshare</name>
	<name xml:lang="es">Compartir / Descompartir</name>
    <command>bash /etc/xdg/Thunar/share.sh %n %f</command>
    <description></description>
    <patterns>*</patterns>
    <directories/>
  </action>

</actions>
